artist_name,biography,listeners,playcount,similar_artists
Mrs. GREEN APPLE,"Mrs. GREEN APPLE (ミセスグリーンアップル) is a 3, formerly 5 member Jrock band from Tokyo that debuted in 2013 an made their major debut in 2015 under EMI Records and Universal Music Japan. 

The curent member are Motoki Ohmori, Hiroto Wakai and Ryoka Fujisaki <a href=""https://www.last.fm/music/Mrs.+GREEN+APPLE"">Read more on Last.fm</a>",382162,10278953,"['back number', 'Official髭男dism', '優里', 'tuki.', 'Novelbright']"
Agrupación Musical Nuestro Padre Jesús de la Redención de Sevilla," <a href=""https://www.last.fm/music/Agrupaci%C3%B3n+Musical+Nuestro+Padre+Jes%C3%BAs+de+la+Redenci%C3%B3n+de+Sevilla"">Read more on Last.fm</a>",773,14705,"['Agrupación Musical Ntra. Sra. de la Encarnación', 'Virgen de los Reyes', 'Las Cigarreras', 'Agrupación Musical Ntra. Sra. De Los Reyes', 'Agrupación Musical Ntra. Sra. de la Estrella de Dos Hermanas']"
美波,"Minami (美波)  (born September 14, 1997 in Japan), is a Japanese  singer-songwriter. 

On August 24, 2017, she held the first one man live at Shibuya Eggman . It was a live title ""Emotional Water ~ my teen finale ~ "" as she realized her dream of hosting a one-man live in her teens.
On February 21, 2018, at the same venue, the second one-man live "" ETERNAL BLUE "" was held, where she announced her Major debut under ""flying DOG"".
On June 28, 2020, she announced a label change to Warner Music Japan and released a new single <a href=""https://www.last.fm/music/%E7%BE%8E%E6%B3%A2"">Read more on Last.fm</a>",335960,8351115,"['ヨルシカ', '結束バンド', 'Sayuri', 'ZUTOMAYO', 'Aimer']"
Carrie Hope Fletcher,"Carrie Hope Fletcher (Username: ItsWayPastMyBedTime) is an English YouTuber who posts weekly video blogs on the site.

She posted her first video around March 14, 2011 and her channel is a mix of singing and vlogging (video-blogging).

She has starred as Eponine in Les Miserables at the Queen's Theater in London since June 2013 and won a What's on stage Award for Best Takeover in a Role for her performance.  Carrie announced on November 18, 2013 that she will be featuring in the UK tour of War of the Worlds in late 2014. <a href=""https://www.last.fm/music/Carrie+Hope+Fletcher"">Read more on Last.fm</a>",106994,1827459,"['Jamie Muscato', 'Taylor Louderman', 'Grey Henson', 'Sophia Anne Caruso', 'Emily Rohm']"
Alex Brightman,"Alexander Michael Brightman (born February 5, 1987) is an American actor, singer, and writer. He is best known for his work in musical theatre, specifically as Dewey Finn in the musical adaptation of School of Rock and the title character in Beetlejuice the Musical. Both roles earned him nominations for the Tony Award for Best Actor in a Musical in 2016 and 2019 respectively.

Brightman was revealed in 2020 to be voicing the character Fizzarolli, and his robotic doppelganger Robo Fizz, in the animated web series Helluva Boss. <a href=""https://www.last.fm/music/Alex+Brightman"">Read more on Last.fm</a>",264876,4441948,"['Leslie Kritzer', 'Sophia Anne Caruso', 'Erika Henningsen', 'Daphne Rubin-Vega', 'Christian Borle']"
FictionJunction,"FictionJunction is a singing group from Tokyo, Japan, that solely performs songs written by Japanese composer Yuki Kajiura (梶浦由記). The term ""FictionJunction"" alone refers to this group; solo works between Kajiura and a vocalist are referenced by adding the singer's name after ""FictionJunction"".
Although both perform under the FJ title and are collaborations with Kajiura, they are separate projects. FictionJunction songs have been featured in anime series such as Gundam Seed, Ookami Kakushi, and most recently Sacred Seven. <a href=""https://www.last.fm/music/FictionJunction"">Read more on Last.fm</a>",83106,2070045,"['Kalafina', 'FictionJunction YUUKA', 'See-Saw', '梶浦由記', 'KOKIA']"
Sophia Anne Caruso," <a href=""https://www.last.fm/music/Sophia+Anne+Caruso"">Read more on Last.fm</a>",145743,2294625,"['Leslie Kritzer', 'Alex Brightman', 'Grey Henson', 'Taylor Louderman', 'Barrett Wilbert Weed']"
Tricker,"Gino Sciaraffia Acevedo was born in Iquique, Chile, on December 1, 1998, surrounded by music and art thanks to his family.
Raised in Santiago since he was 8 years old, he developed his passion for music, and since he was 13, he has been dedicated to creating musical covers on YouTube under the pseudonym ""Tricker."" <a href=""https://www.last.fm/music/Tricker"">Read more on Last.fm</a>",23743,369809,"['Mon Laferte', 'Inheres', 'Nattalia Sarria', 'Los Bunkers', 'Glup!']"
T'Shan Williams," <a href=""https://www.last.fm/music/T%27Shan+Williams"">Read more on Last.fm</a>",40566,382698,"['Sophie Isaacs', 'Alice Lee', 'Tiffany Tatreau', 'Scott Redmond', 'Kate Shindle']"
Jamie Muscato,"Jamie Muscato (born 12 April, 1990) is an English actor and singer.
Most known for his portrayal of Jason Dean in the original London run of Heathers: The Musical in 2018, he has starred in several other West End shows since his professional debut in 2009. As a teenager, he was in a production of Unforgotten as a member of the British Youth Music Theatre, continuing his musical theatre training and appearing in other musical theatre competitions. <a href=""https://www.last.fm/music/Jamie+Muscato"">Read more on Last.fm</a>",120302,1500912,"['Carrie Hope Fletcher', 'Taylor Louderman', 'Eva Noblezada', 'Jonathan Bailey', 'Lily James']"
Masayuki Suzuki,"See 鈴木雅之 <a href=""https://www.last.fm/music/Masayuki+Suzuki"">Read more on Last.fm</a>",202480,3451423,"['MOB CHOIR', 'OxT', 'Halca', 'Ryokuoushoku Shakai', 'Masayoshi Oishi']"
Vishal-Shekhar,"Vishal-Shekhar are a music directing duo for Bollywood films. They have had a number of successes including Salaam Namaste and Dus.

The duo rose in prominence when they composed the score for the film Kaante, which included the hit song Ishq Samander. There efforts paid off when they won the Filmfare RD Burman Award for New Music Talent for Jhankaar Beats. The music for the film Musafir became very popular with youth. They combined techno music with Indian sounds. <a href=""https://www.last.fm/music/Vishal-Shekhar"">Read more on Last.fm</a>",198140,8508573,"['Pritam', 'Shankar-Ehsaan-Loy', 'Salim–Sulaiman', 'Sachin-Jigar', 'Sohail Sen']"
Roomtone,"There are multiple artists with the name ""Roomtone""

1. Roomtone was a lo-fi, abstract folk duo from Rochester, New York. They were active from 2001 until 2003, recording a few songs which were compiled on an EP. Gabe Darling (vocals, guitar) now plays with O'Death and Steven Danglis (synthesizer, misc) played in Science vs. Witchcraft.

2. Roomtone is an acoustic act from Philadelphia, Pennsylvania. <a href=""https://www.last.fm/music/Roomtone"">Read more on Last.fm</a>",35896,347751,"['Friedrich Habetler', 'Gabriele Motta', 'Abel III', 'Pharozen', 'Juora']"
Steven Universe,"Artist is used to label background music and insert songs from the Cartoon Network animated series Steven Universe. Music for the series is primarily composed by Aivi & Surasshu, Jeff Liu, Ben Levin, and series creator Rebecca Sugar. Many tracks are available for listening on Aivi & Surasshu and Jeff Liu's official soundcloud pages and are labeled as Steven Universe on these pages. <a href=""https://www.last.fm/music/Steven+Universe"">Read more on Last.fm</a>",891758,49815692,"['Adventure Time', 'Zach Callison', 'aivi & surasshu', 'Rebecca Sugar', 'OR3O']"
John Powell,"John Powell (born 18 September 1963) is an English composer, best known for his scores to motion pictures. He has been based in Los Angeles since 1997 and has composed the scores to over fifty feature films. He is particularly known for his scores for animated films, including Antz, Chicken Run, Shrek (all three co-composed with Harry Gregson-Williams), Robots, Happy Feet (and its sequel), three Ice Age sequels, Rio, and the How to Train Your Dragon film series, for which he was nominated for an Academy Award for the first film. <a href=""https://www.last.fm/music/John+Powell"">Read more on Last.fm</a>",766742,20126221,"['James Horner', 'James Newton Howard', 'Michael Giacchino', 'John Williams', 'Alan Silvestri']"
Ludvig Forssell,"Ludvig Forssell is a Swedish composer, songwriter, and voice actor, as well as an audio director at Kojima Productions. He composed the soundtrack for Death Stranding.

For the Metal Gear series, he composed the soundtracks for Metal Gear Solid V: Ground Zeroes and Metal Gear Solid V: The Phantom Pain. Forssell also wrote the lyrics for Sins of the Father, performed by Donna Burke and ""Quiet's Theme"", performed by Stefanie Joosten. As an actor, he provided the voices of minor characters, and the likeness for the Shago Platoon commander.  <a href=""https://www.last.fm/music/Ludvig+Forssell"">Read more on Last.fm</a>",114507,2332458,"['Donna Burke', 'Joel Corelitz', '日比野則彦', 'Harry Gregson-Williams', 'Jamie Christopherson']"
Eva Noblezada," <a href=""https://www.last.fm/music/Eva+Noblezada"">Read more on Last.fm</a>",112294,2550124,"['Amber Gray', 'Patrick Page', 'André De Shields', 'Hadestown Original Broadway Company', 'Jeremy Jordan']"
ASCA,"ASCA (born September 5, 1996 in Aichi, Japan) is a Japanese pop singer signed to SACRA MUSIC. She was the 5th Anisong Grand Prix finalist with Suzuki Konomi. Under her given name Okura Asuka, she performed the second ending theme for the anime series Sakurasou no Pet na Kanojo. She changed her stage name to ASCA before releasing her major debut single ""KOE"". <a href=""https://www.last.fm/music/ASCA"">Read more on Last.fm</a>",78806,1704073,"['Eir Aoi', 'ReoNa', '鈴木このみ', 'GARNiDELiA', 'ZAQ']"
Miyu Tomita," <a href=""https://www.last.fm/music/Miyu+Tomita"">Read more on Last.fm</a>",25812,206664,"['sweet ARMS', 'Mayu Maeshima', '鈴木このみ', 'Maon Kurosaki', 'Kaori Ishihara']"
Hildur Guðnadóttir,"Hildur Ingveldardóttir Guðnadóttir (born 4 September 1982) is an Icelandic musician and composer. A classically trained cellist, she has played and recorded with the bands Pan Sonic, Throbbing Gristle, Múm and Stórsveit Nix Noltes, has collaborated with Sunn O))) and toured with Animal Collective. In 2020, she won the Academy Award for Best Original Score for her work on the film ""Joker"".

In 2006, she released a solo album under the name Lost In Hildurness, Mount A, on which she attempted to ""involve other people as little as I could. <a href=""https://www.last.fm/music/Hildur+Gu%C3%B0nad%C3%B3ttir"">Read more on Last.fm</a>",255369,4019301,"['Jóhann Jóhannsson', 'Julia Kent', 'Max Richter', 'Cliff Martinez', 'Steven Price']"
the peggies,"The Peggies (Japanese: ザ・ペギーズ) was a Japanese all-female band from Kanagawa Prefecture, Japan, formed in 2011. The band was signed with Poppo Express and was affiliated with Epic Records Japan. Its affiliation office was called MOVING ON. The band went on indefinite hiatus in July 2022.

Members.
Yuuho Kitazawa (北澤 ゆうほ)
Date and place of birth: December 2, 1995.
She is the vocalist and the guitarist of the band. Also, she is in charge of songwriting, composition, and arrangement of songs. <a href=""https://www.last.fm/music/the+peggies"">Read more on Last.fm</a>",202951,5372601,"['Halca', 'kessoku band', 'KANA-BOON', 'ZUTOMAYO', 'Sayuri']"
Madkid,"MADKID is a Japanese boy group consisting of You-ta, Lin, KAZUKI, Yuki, SHIN. 

They had membership changes before setting on their current lineup, their original leader was Kento, now a member of IVVY, who left the year they formed, 2014, replaced by You-ta. Original member Rikito left in May of 2015, replaced with CASEY in the summer of that year, who then left in January 2016. The last of the current members to join, thus replacing CASEY, was Shin, who joined Feb 1 2017. <a href=""https://www.last.fm/music/Madkid"">Read more on Last.fm</a>",73755,1165962,"['OxT', '鈴木このみ', 'MindaRyn', '前島麻由', 'MYTH & ROID']"
Hadestown Original Broadway Company," <a href=""https://www.last.fm/music/Hadestown+Original+Broadway+Company"">Read more on Last.fm</a>",82257,1426184,"['André De Shields', 'Amber Gray', 'Eva Noblezada', 'Kimberly Marable, Khaila Wilcoxon, Ahmad Simmons, Afra Hines, T. Oliver Reid, John Krause, André De Shields, Reeve Carney, Jewelle Blackman, Yvette Gonzalez-Nacer, Kay Trinidad, Timothy Hughes, Malcolm Armwood & Jessie Shelton', 'André De Shields, Hadestown Original Broadway Company']"
Jewelle Blackman," <a href=""https://www.last.fm/music/Jewelle+Blackman"">Read more on Last.fm</a>",59664,890027,"['Samantha Pauly', 'Noah J. Ricketts', 'Next To Normal 2024 Original London Company', 'Sara Chase', 'Carrie Compere']"
King Gnu,"King Gnu (キングヌー) is a pop/rock band from Tokyo formed in 2013. They were formerly known as Mrs.Vinci or Srv.Vinci, but adopted their current monicker in 2017. They rose to fame in Japan through the release of their second album Sympa, and the singles leading up to their third album Ceremony. <a href=""https://www.last.fm/music/King+Gnu"">Read more on Last.fm</a>",447085,15793456,"['米津玄師', 'Vaundy', 'Official HIGE DANdism', 'Mrs. GREEN APPLE', 'キタニタツヤ']"
Aaron Tveit,"Aaron Kyle Tveit (/təˈveɪt/;[1] born October 21, 1983) is an American actor and singer. He is known for originating the roles of Gabe in Next to Normal, Frank Abagnale Jr. in the stage version of Catch Me If You Can, and the role of Christian in Moulin Rouge! The Musical on Broadway. He is also known for his recurring role as Tripp van der Bilt on The CW's teen drama series Gossip Girl, his portrayal of Enjolras in the 2012 film adaptation of Les Misérables <a href=""https://www.last.fm/music/Aaron+Tveit"">Read more on Last.fm</a>",201772,3117554,"['Alice Ripley', ""Brian D'Arcy James"", 'Patrick Page', 'Alan Cumming', 'Hadestown Original Broadway Company']"
Ricky Rojas," <a href=""https://www.last.fm/music/Ricky+Rojas"">Read more on Last.fm</a>",16249,150862,"['Danny Burstein', 'Tam Mutu', 'Sahr Ngaujah', 'Karen Olivo', 'Cassidy Janson']"
Paweł Błaszczak,"Paweł Błaszczak is a Polish game music composer, who created soundtracks for Techland games Dying Light, Call of Juarez, and Call of Juarez: Bound in Blood. He also wrote the music for Chrome and The Witcher in collaboration with Adam Skorupa. He created his first compositions for the video game developer Techland in 1997. He currently works as a freelance composer. <a href=""https://www.last.fm/music/Pawe%C5%82+B%C5%82aszczak"">Read more on Last.fm</a>",11125,424784,"['Adam Skorupa', 'Krzysztof Wierzynkiewicz', 'Adam Skorupa & Krzysztof Wierzynkiewicz', 'Marcin Przybyłowicz', 'Olivier Deriviere']"
Amber Gray,"Amber Renae Gray (born April 2, 1981) is an American actress and singer. She is known for portraying Hélène Bezukhova in the 2016 Broadway musical Natasha, Pierre, & the Great Comet of 1812 and for originating the role of Persephone in the musical Hadestown, both off and on Broadway. For the latter 2019 role, she was nominated for the Tony Award for Best Featured Actress in a Musical, additionally earning the 2020 Grammy Award for Best Musical Theater Album. <a href=""https://www.last.fm/music/Amber+Gray"">Read more on Last.fm</a>",78535,1296079,"['Patrick Page', 'Eva Noblezada', 'André De Shields', 'Hadestown Original Broadway Company', 'Original Cast of Hadestown']"
Danny Burstein," <a href=""https://www.last.fm/music/Danny+Burstein"">Read more on Last.fm</a>",30917,399423,"['Tam Mutu', 'Sahr Ngaujah', 'Ricky Rojas', 'Karen Olivo', 'Adam Kantor']"
10cm,"10cm (십센치) is the musical project of South Korean singer-songwriter Kwon Jungyeol (권정열). Originally a two-member band, member Yoon Cheoljung (윤철정) left the band in 2017.

The duo was formed in 2009, and debuted in 2010 with the release of their debut EP 'The 1st'. The band won ""This Year's Discovery Award"" at the 2010 Mnet Asian Music Awards, and ""Best Pop Single Award"" at the 2011 Korean Music Awards.

Kwon continued to promote under 10cm following the departure of Yoon in 2017 <a href=""https://www.last.fm/music/10cm"">Read more on Last.fm</a>",265519,5876449,"['Sam Kim', 'Kim Kyung Hee', 'Jung Seung Hwan', 'Lee Mujin', 'DAVICHI']"
Empire,"There are (or were) at least 14 bands called Empire including a podcast produced by the UK film magazine Empire.

1) EMPiRE, were a Japanese female idol group which debuted in August of 2017 and disbanded 2nd June 2022. They were launched as a joint project between the record label avex and Watanabe Junnosuke's agency, WACK, going by the name ""Project aW"" before debut. The founding members were YUKA EMPiRE, MiDORiKO EMPiRE, MAYU EMPiRE, YU-Ki EMPiRE, and YUiNA EMPiRE. <a href=""https://www.last.fm/music/Empire"">Read more on Last.fm</a>",68932,1102434,"['BAND-MAID', 'Tony Martin', 'Krokus', 'Pretty Maids', 'Quiet Riot']"
Reeve Carney,"Reeve Jefferson Carney (born April 18, 1983) is an American singer-songwriter and actor most known for originating the role of Peter Parker/Spider-Man in Spider-Man: Turn Off the Dark on Broadway and playing Orpheus in the Original Broadway Cast of Hadestown. He also played Dorian Gray in the Showtime series Penny Dreadful and Riff Raff in the Fox musical television film The Rocky Horror Picture Show: Let's Do the Time Warp Again.
He is currently on Broadway as Orpheus in the Tony Award-winning musical Hadestown <a href=""https://www.last.fm/music/Reeve+Carney"">Read more on Last.fm</a>",137011,3296792,"['Patrick Page', 'Amber Gray', 'Eva Noblezada', 'André De Shields', 'Hozier']"
Marc Streitenfeld,"Marc Streitenfeld is a German film score composer, known for his collaborations with director Ridley Scott.

Born in Munich, Germany, Streitenfeld relocated to Los Angeles at the age of 19, first working briefly as a musical assistant for composer Hans Zimmer, then independently as a music editor and supervisor on several blockbusters.

At the request of Ridley Scott, Streitenfeld composed for A Good Year (2006), after acting as music supervisor on Scott's 2005 film Kingdom of Heaven (scored by Harry Gregson-Williams). <a href=""https://www.last.fm/music/Marc+Streitenfeld"">Read more on Last.fm</a>",234488,3229008,"['Jed Kurzel', 'William Ross', 'Steven Price', 'Harry Gregson-Williams', 'Fernando Velázquez']"
Clinton Shorter,"Clinton Shorter (born March 18, 1971) is a Canadian film and television composer. He is particularly known for his score for Neill Blomkamp's film District 9. He has also composed the music for over 300 television episodes.

Shorter was born in North Vancouver, British Columbia. He initially studied jazz in college before switching to music composition.

Shorter created the score for an independent film, Come Together, in Vancouver. He went on to create music for several more films in the Vancouver area <a href=""https://www.last.fm/music/Clinton+Shorter"">Read more on Last.fm</a>",113247,1953194,"['Reynard Seidel', 'Joel Nielsen', 'Mychael Danna', 'Ryan Taubert', 'cxrgi']"
Arijit Singh,"Arijit Singh (Hindi:अरिजित सिंह; born 25 April 1987 in Murshidabad, India) is an Indian playback singer whose songs have been featured in recent Bollywood movies. He was one of top six contestants in reality-singing series, Fame Gurukul in 2005 and became an assistant to music director Pritam.

Singh is a trained classical singer who has performed in many stage shows. His career as a playback singer started when he participated in a singing reality show called Fame Gurukul (2005), while still in college. <a href=""https://www.last.fm/music/Arijit+Singh"">Read more on Last.fm</a>",189174,9703787,"['Vishal Mishra', 'Atif Aslam', 'Ankit Tiwari', 'Pritam', 'Mithoon']"
Steven Price,"Steven Price (born 22 April 1977 in Nottingham, England, UK) is a British film composer, best known for scoring The World's End and Gravity, both from 2013. For the latter film he received an Academy Award win for Best Original Score.
Along with Basement Jaxx, Price scored the 2011 film Attack the Block, and the soundtrack was released on 16 May 2011. <a href=""https://www.last.fm/music/Steven+Price"">Read more on Last.fm</a>",191869,2720672,"['Harry Gregson-Williams', 'James Newton Howard', 'Marc Streitenfeld', 'Hans Zimmer', 'Steve Jablonsky']"
Ivo Pattiera," <a href=""https://www.last.fm/music/Ivo+Pattiera"">Read more on Last.fm</a>",448,2171,"['Klapa Maslina', 'Klapa Šibenik', 'Tomislav Ivčić', 'Đani Maršan', 'Nenad Kero']"
krunoslav kićo slabinac,"Born in Osijek on 28th of March 1948. He started his singing career with Osijek's pop groups and his solo career was marked by song ""Plavuša"" (eng. Blonde:P). Nowadays he sings on festivals, winner of many awards, he often goes on tours for Croatian diaspora. He is a succesfull hit composer, founder of ""tambura"" band ""Bećari"" with whom he entertains and fosters original melodies of Croatian people.


//


Rođen u Osijeku 28.03.1948. S pjevanjem je započeo u Osiječkim pop grupama a solističku karijeru obilježila mu je skladba Plavuša. <a href=""https://www.last.fm/music/krunoslav+ki%C4%87o+slabinac"">Read more on Last.fm</a>",1010,8483,"['Zlatni Dukati', 'Gazde', 'Slavonske Lole', 'Najbolji Hrvatski Tamburaši', 'Zlatko Pejaković']"
Группа 101," <a href=""https://www.last.fm/music/%D0%93%D1%80%D1%83%D0%BF%D0%BF%D0%B0+101"">Read more on Last.fm</a>",496,5360,"[""Rin'Go"", 'Батыр', 'Kazybek Kuraiysh', 'Orda', 'Орда']"
Tereza Kesovija,"Croatian singer Tereza Kesovija was born in Dubrovnik where she got her early music education. She won a federal young Musicians Competition in Ljubljana (Slovenia). After that she graduated the flute at the Academy of Music in Zagreb (in the class of Theo Tabak) and as student started appearing in non-professional stages. Her exceptional musicality and command of the stage, as well as a beautiful voice of particular colour and timbre and a high-profile professional personality gained her international career. <a href=""https://www.last.fm/music/Tereza+Kesovija"">Read more on Last.fm</a>",4735,77489,"['Meri Cetinic', 'Jasna Zlokic', 'Gabi Novak', 'Vinko Coce', 'Mladen Grdović']"
Badal Paul," <a href=""https://www.last.fm/music/Badal+Paul"">Read more on Last.fm</a>",6,24,[]
Urbanus,"Urbain Servranckx (June 7, 1949, Schepdaal, Belgium), also known as Urbain and Urbanus van Anus, is a Belgian comedian, actor, singer and comic book 'hero'. He shocked the Flemish conservative fraction by writing a song that is a parody on the birth of Jesus.

In 1984, Urbanus and Willy Linthout began writing comic books with Urbanus himself as the main character. As of 2005 more than a hundred such comic books have been published.

His first movie <a href=""https://www.last.fm/music/Urbanus"">Read more on Last.fm</a>",28607,472737,"['Flip Kowlier', 'Clouseau', 'De Kreuners', 'Raymond van het Groenewoud', 'De Mens']"
Prajoth D'sa," <a href=""https://www.last.fm/music/Prajoth+D%27sa"">Read more on Last.fm</a>",30,112,"['Brosinthemix', 'Henry T. D Souza', 'The 7 Notes Band', 'Gonzaga Coutinho', 'Alison Gonsalves']"
Đani Maršan,"Đani Maršan is a croatian musician, born 23rd of June, 1944. in Zadar.
He served as a merchant navy officer for two years. In 1969. he graduated on College for foreign trade in Zagreb. He acitvely speaks English and Italian, and also uses German, Russian and Albanian language.
Till now he he had recorded and released about 30 EPs, ten albums and five CDs. With Croatian, he also records on Italian, English and German. He is the author of lyrics and music for more than 80 songs. <a href=""https://www.last.fm/music/%C4%90ani+Mar%C5%A1an"">Read more on Last.fm</a>",1946,19470,"['Tomislav Ivčić', 'Vinko Coce', 'Mladen Grdović', 'Mišo Kovač', 'Milo Hrnić']"
HARI RONČEVIĆ,"Hari Rončević is famous Croatian songwriter and singer from Split, well known for his touching lyrics and mellow guitar playing.

He appeared in year 1994. for the first time on ""Melodije Hrvatskog Jadrana"" (Croatian Adriatic Sea Melodies) festival and immediately won the 1. prize as decided by expert jury. 

After that his career starts to ascend, he published his first album ""Buntovnik s razlogom"" (Rebel with a cause) in 1994., followed by ""Žigolo"" (Gigolo) <a href=""https://www.last.fm/music/HARI+RON%C4%8CEVI%C4%86"">Read more on Last.fm</a>",1768,26343,[]
Stan Van Samang,"Stan van Samang is an actor. He played the role of 'Kevin' in one of Flanders famous sitcoms called 'Wittekerke'. He was discovered as music talent during the tv-shows 'Steracteur Sterartiest' (a show in which actors sang for good purposes. The winner of the shows, earned money for that good purpose). Stan won and got a record deal a few weeks later. <a href=""https://www.last.fm/music/Stan+Van+Samang"">Read more on Last.fm</a>",13159,145143,"['Wim Soutaer', 'Gene Thomas', ""Mama's Jasje"", 'Slongs Dievanongs', 'Paul Severs']"
Datuk Ahmad Jais," <a href=""https://www.last.fm/music/Datuk+Ahmad+Jais"">Read more on Last.fm</a>",2862,17763,"['Datuk Sharifah Aini', ""Dato' DJ Dave"", 'Nyanyian Ramai', 'Sanisah Huri', 'Rahimah Rahim']"
Klapa Maslina," <a href=""https://www.last.fm/music/Klapa+Maslina"">Read more on Last.fm</a>",3969,35933,"['Vinko Coce', 'Klapa Intrade', 'Tomislav Bralić', 'Klapa Kampanel', 'Mladen Grdović']"
Lalitya Munshaw," <a href=""https://www.last.fm/music/Lalitya+Munshaw"">Read more on Last.fm</a>",3202,20731,"['Prem Prakash Dubey', 'Susmirata Dawalkar', 'Anjali Jain', 'Vandana Bhardwaj', 'Satish Dehra']"
